MCQ,Choices,Correct,Explanation
What is the primary goal of machine learning?,a: Achieving artificial intelligence | b: Tackling solvable problems of a practical nature | c: Focusing on symbolic approaches inherited from AI | d: Using only neural networks for all tasks,b,The primary goal of machine learning shifted from achieving artificial intelligence to tackling solvable problems of a practical nature.
Which field of study focuses on exploratory data analysis via unsupervised learning?,a: Data mining | b: Neural networks | c: Reinforcement learning | d: Structured prediction,a,Data mining is a related field of study that focuses on exploratory data analysis (EDA) via unsupervised learning.
Who coined the term 'machine learning' in 1959?,a: Alan Turing | b: Donald Hebb | c: Arthur Samuel | d: Tom M. Mitchell,c,"The term 'machine learning' was coined in 1959 by Arthur Samuel, an IBM employee and pioneer in the field of computer gaming and artificial intelligence."
Which algorithm is used for optimal data compression by predicting the posterior probabilities of a sequence?,a: K-means clustering | b: Backpropagation | c: Arithmetic coding | d: Perceptrons,c,An algorithm that predicts the posterior probabilities of a sequence can be used for optimal data compression by using arithmetic coding on the output distribution.
What is the relationship between deep learning and machine learning?,a: Deep learning is a subset of machine learning | b: Machine learning is a subset of deep learning | c: Deep learning and machine learning are unrelated | d: Deep learning replaced machine learning,a,"Deep learning is a subset of machine learning, which is itself a subset of artificial intelligence."
